criterion,weight_percent,control_expert_prior_1_5,proof_led_expert_prior_1_5,sparse_signal_expert_prior_1_5,measurement_after_test,decision_note
"Category comprehension",25,3,4,4,"Unaided domain recognition by cohort","The proposition may be mysterious; the field cannot be."
"Primary-route clarity",20,1,4,5,"First-try Selected Work under 10 seconds","Current production baseline hides the action at 1280×720."
"Credibility / proof",20,2,2,3,"Credibility rating plus verbatim trust reason","Proof-led remains 2 until its concept surface is replaced by a genuinely inspectable artefact."
"Brand distinctiveness",15,4,4,5,"Originality and generic ratings","Sparse signal retains the visual grammar without an invented instrument panel."
"Human approachability",10,2,3,3,"Human / approachable and arrogance medians","Founder-led wording helps; form alone cannot guarantee warmth."
"Mobile resilience",10,1,4,5,"Reading-order task plus WCAG / information-loss audit","All prototypes move actions before the secondary right-side content."
"WEIGHTED EXPERT PRIOR",100,2.25,3.50,4.15,"Not a final result","Ordinal screening only. Human gates override this prior; do not treat decimals as behavioural precision."
